{
  "version": "dgp-s-lgc-s",
  "generated_or_manual": "manual",
  "current_phase": "DGP-S / LGC-S closed; next MR-0",
  "registry_index_command": "ordivon-verify registry-index --check",
  "last_verified": "2026-05-09",
  "owner": "Governance",
  "archive_warning": "Documents with status closed/archived/superseded are historical, not current truth.",
  "generated_view_warning": "Generated views (registry-index output, verification-gate-manifest) are derived artifacts, not source_of_truth.",
  "current_truth_docs": [
    "docs/ai/README.md",
    "docs/ai/ordivon-root-context.md",
    "docs/ai/current-phase-boundaries.md",
    "docs/ai/current-system-map.md",
    "docs/ai/new-ai-collaborator-guide.md",
    "docs/ai/agent-working-rules.md",
    "docs/ai/agent-output-contract.md",
    "docs/governance/current-truth-entry-map.jsonl",
    "docs/governance/document-authority-model-dgp-3.md",
    "docs/governance/document-lifecycle-governance-dgp-2.md",
    "docs/architecture/ordivon-companion-governance-constitution.md",
    "docs/architecture/ordivon-core-pack-adapter-ontology.md",
    "docs/architecture/ordivon-moat-and-product-identity.md",
    "docs/governance/philosophical-governance-layer.md"
  ],
  "root_context_docs": [
    "docs/ai/ordivon-root-context.md",
    "docs/ai/current-phase-boundaries.md",
    "docs/ai/current-system-map.md"
  ],
  "active_pack_docs": [
    "docs/governance/registry-object-model-rg-1.md",
    "docs/governance/document-lifecycle-governance-dgp-2.md",
    "docs/governance/document-authority-model-dgp-3.md",
    "docs/ai/onboarding-protocol-dgp-4.md"
  ],
  "no_go_docs": [
    "docs/ai/no-go-boundary-map.md"
  ],
  "receipt_contract_docs": [
    "docs/ai/agent-output-contract.md",
    "docs/governance/phase-receipt-standard-dgp-5.md"
  ],
  "onboarding_reading_order": [
    "docs/ai/README.md",
    "docs/ai/ordivon-root-context.md",
    "docs/ai/current-phase-boundaries.md",
    "docs/ai/current-system-map.md",
    "docs/ai/new-ai-collaborator-guide.md",
    "docs/ai/agent-working-rules.md",
    "docs/ai/agent-output-contract.md",
    "docs/governance/current-truth-entry-map.jsonl",
    "docs/ai/onboarding-protocol-dgp-4.md"
  ]
}
